Ref,Name,Description,Dynamic Behaviour,Default State,Error State,Content Rules
1,Title,N/A,Title is optional,N/A,N/A,N/A
2,Description text block,Describe the object,restrict messages to 3 lines in length,N/A,N/A,N/A
3,Spotlight area,The area on the page that requires user's attention,N/A,N/A,N/A,N/A
4,Stepper,Indicate how many steps,Stepper is optional,,,
5,Card container,N/A,Card container is at 340px wide,,,
6,Close button,This button allows the user to close the explainer card,Click this button to close the explainer card,N/A,N/A,N/A
7,Media content,Media content could be image or video,Media content is optional,N/A,N/A,N/A
8,Primary action,Main CTA,CAT or next / back buttons (optional),N/A,N/A,N/A