Object,Number,Name,Description,Dynamic Behavior,Default State,Error State,Content Rules
IF.0 Text fields,1,Label text,Label text is used to inform users as to what information is requested for a text field.,"When text input isn't accepted, an error message replace the label text until fixed.",Display the form label text,Display error icon and error message in red color,"Form labels are typically nouns
For form labels that require action, start with a verb e.g Select card type
Form labels should always make it clear which field they should fill in
Label input fields with short, 1-2 word nouns e.g name, date, area code etc.
 Label text should not exceed the width of the input field. Labels may be truncated but editing for length is preferred
Avoid overly long labels
Don’t wrap label text
Labels don’t need punctuation like periods or colons.
The error message temporarily replaces the field label, so the message must provide instruction on how to fix the error AND include the name of the field to make it clear which field is affected
State the issue clearly and in a way that does not assign blame
Provide a remedy when possible
Provide only the information the user needs to know at this moment"
IF.0 Text fields,2,Single line input field,Users can enter or edit a string of text.,"By default, all the text input fields are required. When a text input field is optional, show “(optional)” in placeholder.",N/A,The field outline turn to red color,
IF.0 Text fields,3,Multi-lines input field,"Allows for longer, multi-line responses, for things like label descriptions.","By default, all the text input fields are required. When a text input field is optional, show “(optional)” in placeholder.",N/A,The field outline turn to red color,