Object,Number,Name,Description,Dynamic Behavior,Default State,Error State,Content Rules
FP.0 Frequency Picker,1,Primary Field,"The primary entry field allows the user to enter an natural number which allows them to set the frequency per hour, day, week or month.","The natural number  1 will be entered into this field by default. This is a required field.
Values : 1 to 12? TBD/Depends on product context",The natural number 1 will be entered into this field by default.,This field will need to be validated for any non natural number and will automatically switch to nearest natural number and closest to any decimal entered or should prevent users from entering any decimal or negative values,N/A
FP.0 Frequency picker,2,Primary frequency Dropdown,"This dropdown allows the user to select between hour, day, week and month options for overall frequency.","If the dropdown selection is “hour” the time dropdown (3) is removed from the widget. 
Values : “Hour”, “Day”, “Week”, “Month”",By default the dropdown will display “Days”.,N/A,N/A
FP.0 Frequency picker,3,Time Dropdown,This dropdown allows the user to select a specific time when the frequency should be triggered.,"If the freqency dropdown (2) selection is “hour” the time dropdown (3) is removed from the widget. 
Values : “10:00”, “10:30”, “11:00” and so on...
TBD/Depends on product context",By default the time picker will be set to 10:00 AM and set to the user’s cluster timezone.,N/A,N/A
FP.0 Frequency picker,4,Day selection Cluster,This dropdown allows the user to select a specific day when the frequency should be triggered.,"This cluster only appears when the user has selected the “week” option from the primary frequency dropdown (2)Multiple days can be selected
Values : Single or multiple selection from
M, T, W, Th, F, Sa, Su",By default “Monday” is selected.,N/A,N/A
FP.0 Frequency picker,5,Month selection: Dropdown Input1,"This input allows the user to pick the type of monthly frequency they want to set, IF the user has selected the “month” input from the primary frequency dropdown (2)","This input allows the user to pick the type of monthly frequency they want to set, IF the user has selected the “month” input from the primary frequency dropdown (2)
Values : “By date”, “On the”",By default “On the” is selected.,N/A,N/A
FP.0 Frequency picker,6,Month selection: Dropdown Input2A,"This input allows the user to set monthly frequency in context of days of the week, If the user has selected the “month” input from the primary frequency dropdown (2)","This input only appears when the user has selected “On the” option from the Month selection: Dropdown Input1 (5)
Values : 
Dropdown 1: “First”, “Second”, “Third”, “Fourth”, “Last”
Dropdown 2: “Monday”, “Tuesday”, “Wednesday”, “Thursday”, “Friday”, “Saturday”, “Sunday”, “Day”",By default “First” + “Monday” is selected.,N/A,N/A
FP.0 Frequency picker,7,Month selection: Text Input2B,"This input allows the user to set monthly frequency in context of dates of the month, IF the user has selected the “month” input from the primary frequency dropdown (2)","This input only appears when the user has selected “By date” option from the Month selection: Dropdown Input1 (5)
Values : Numbers between 1 to 31, separated by commas","This input will be empty by default, this is a required field.",The enter dates field requires at least one entry to validate this widget.,N/A