Name,Content Rules,Default State,Description,Dynamic Behaviour,Error State,Ref
Options title,,N/A,The name of this group of options,N/A,N/A,2
Modal title,,N/A,"This title let users know they are editing which column property ",N/A,N/A,1
Single object list picker,N/A,N/A,These are all the column values that can be chosen,"Single selection only
Check https://www.notion.so/309374cae3fa812895d1deffcef72709?pvs=21
There is no selection for default state.

Selected state Object%20Table%20309374cae3fa8113b439c8bb096e0478.mdObject%20Table%20309374cae3fa8113b439c8bb096e0478.md",N/A,3